<netlicensing xmlns="http://netlicensing.labs64.com/schema/context"
              xmlns:xsi="http://www.w3.org/2001/XMLSchema-instance"
              xsi:schemaLocation="http://netlicensing.labs64.com/schema/context
                                  https://go.netlicensing.io/schema/context/netlicensing-context-2.1.xsd">
    <items pagenumber="0" itemsnumber="3" totalpages="1" totalitems="3" hasnext="false">
        <item type="Bundle">
            <property name="number">B001-TEST</property>
            <property name="active">true</property>
            <property name="name">Bundle 1</property>
            <property name="description">Description 1</property>
            <property name="price">10</property>
            <property name="currency">EUR</property>
            <property name="licenseTemplatesNumbers">LT001-TEST,LT002-TEST</property>
        </item>
        <item type="Bundle">
            <property name="number">B002-TEST</property>
            <property name="active">true</property>
            <property name="name">Bundle 2</property>
            <property name="description">Description 2</property>
            <property name="price">20</property>
            <property name="currency">USD</property>
            <property name="licenseTemplatesNumbers">LT003-TEST,LT004-TEST</property>
        </item>
        <item type="Bundle">
            <property name="number">B003-TEST</property>
            <property name="active">true</property>
            <property name="name">Bundle 3</property>
            <property name="description">Description 3</property>
            <property name="price">30</property>
            <property name="currency">EUR</property>
            <property name="licenseTemplatesNumbers">LT005-TEST,LT006-TEST</property>
        </item>
    </items>
</netlicensing>
