<netlicensing xmlns="http://netlicensing.labs64.com/schema/context"
              xmlns:xsi="http://www.w3.org/2001/XMLSchema-instance"
              xsi:schemaLocation="http://netlicensing.labs64.com/schema/context
                                  https://go.netlicensing.io/schema/context/netlicensing-context-2.1.xsd">
    <items>
        <item type="Licensee">
            <property name="number">L001-TEST</property>
        </item>
        <item type="ProductModuleValidation">
            <property name="productModuleNumber">M001-TEST</property>
            <property name="licensingModel">FeatureWithTimeVolume</property>
            <property name="productModuleName">Test module</property>
            <list name="LIST1">
                <property name="valid">true</property>
                <property name="expires">2014-08-06T21:30:45.574Z</property>
                <property name="warningLevel">GREEN</property>
            </list>
            <list name="LIST2">
                <property name="valid">true</property>
                <property name="expires">2014-08-06T21:30:45.186Z</property>
                <property name="warningLevel">GREEN</property>
            </list>
        </item>
    </items>
</netlicensing>
